{
  "schema": "skillci.trials.index.v1",
  "skill": "acme-release-notes",
  "version": "v1.1.0",
  "digest": "sha256:e2083e2538efcb137f3375686cca135d50b93c5c9494f73dca707621ba05b490",
  "eval": "acme-release-notes-v1-1-0-codex-0-161-0-openai-gpt-6-1-sol",
  "agent": "codex",
  "agentVersion": "0.161.0",
  "model": "openai/gpt-6.1-sol",
  "entry": "codex@0.161.0/openai/gpt-6.1-sol",
  "runId": "synthetic-codex-0001",
  "evaluatedAt": "2026-10-30T15:03:15.002Z",
  "evaluator": {
    "version": "0.6.0",
    "metricSet": "skill-evaluator-default-v2",
    "scorePolicy": "skill-evaluator-dimension-mean-v1"
  },
  "attemptsPerCase": 1,
  "redaction": "v1",
  "credentials": [
    {
      "role": "agent",
      "env": "OPENAI_API_KEY",
      "host": "api.openai.com"
    },
    {
      "role": "judge",
      "env": "ANTHROPIC_API_KEY",
      "host": "api.anthropic.com"
    }
  ],
  "limits": {
    "stringBytes": 32768,
    "outputBytes": 8192,
    "logTailBytes": 65536,
    "exceptionBytes": 8192,
    "trialBytes": 1048576,
    "bundleBytes": 25165824,
    "trialsPerArm": 50,
    "flowRows": 200
  },
  "cases": [
    {
      "id": "rn-basic",
      "question": "Write the release notes for version 1.4.0 into a file named RELEASE_NOTES.md. Changes: added CSV export (ticket ACME-101), fixed a login timeout (ticket ACME-117).",
      "expectedBehaviors": [
        "RELEASE_NOTES.md exists",
        "The first line is exactly 'ACME-RN/2 1.4.0'",
        "There are exactly two sections, '## Added' then '## Fixed'",
        "Each bullet ends with its ticket ID in square brackets"
      ],
      "expectedSkill": "acme-release-notes"
    }
  ],
  "trials": [
    {
      "id": "rn-basic__Cx7aQ1p",
      "layer": "trial-rn-basic__Cx7aQ1p.json.gz",
      "arm": "with-skill",
      "case": "rn-basic",
      "attempt": 1,
      "status": "scored",
      "score": 0.92,
      "passed": true,
      "startedAt": "2026-10-30T15:00:02.110Z",
      "durationSec": 192.4,
      "agentSec": 48.1,
      "steps": 5,
      "toolCalls": 3,
      "tokensIn": 37758,
      "tokensOut": 299,
      "tokensCached": 27904,
      "costUsd": 0.0173,
      "costSource": "reported",
      "criteria": {
        "passed": 4,
        "total": 4
      },
      "skillInvoked": true,
      "bytes": 3547,
      "rawBytes": 11636,
      "truncated": false,
      "network": {
        "forwarded": 2,
        "dropped": 1,
        "dns": 3
      }
    }
  ],
  "withheld": [
    {
      "id": "rn-basic__Cx2nW9d",
      "arm": "without-skill",
      "case": "rn-basic",
      "attempt": 1,
      "reason": "secret-scan"
    }
  ],
  "network": {
    "state": "collected"
  }
}
